type	count
袨斜褖懈泄袦芯写褍谢褜	3530
袨斜褖邪褟袣邪褉褌懈薪泻邪	1979
袪械谐懈褋褌褉小胁械写械薪懈泄	1313
袩械褉械褔懈褋谢械薪懈械	1160
袣芯薪褋褌邪薪褌邪	734
小锌褉邪胁芯褔薪懈泻	721
袨褌褔械褌	711
袪芯谢褜	665
袨斜褖邪褟袣芯屑邪薪写邪	573
肖褍薪泻褑懈芯薪邪谢褜薪邪褟袨锌褑懈褟	520
袨锌褉械写械谢褟械屑褘泄孝懈锌	501
袩芯写锌懈褋泻邪袧邪小芯斜褘褌懈械	452
袩邪泻械褌XDTO	438
袨斜褖邪褟肖芯褉屑邪	434
袛芯泻褍屑械薪褌	431
袨斜褉邪斜芯褌泻邪	382
袨斜褖懈泄袦邪泻械褌	274
袪械谐谢邪屑械薪褌薪芯械袟邪写邪薪懈械	176
袪械谐懈褋褌褉袧邪泻芯锌谢械薪懈褟	108
袩邪褉邪屑械褌褉小械邪薪褋邪	95
袩芯写褋懈褋褌械屑邪	75
袞褍褉薪邪谢袛芯泻褍屑械薪褌芯胁	38
袩谢邪薪袨斜屑械薪邪	26
Web小械褉胁懈褋	17
袘懈蟹薪械褋袩褉芯褑械褋褋	9
HTTP小械褉胁懈褋	9
袩谢邪薪袙懈写芯胁啸邪褉邪泻褌械褉懈褋褌懈泻	8
袨斜褖懈泄袪械泻胁懈蟹懈褌	7
袩邪褉邪屑械褌褉肖褍薪泻褑懈芯薪邪谢褜薪芯泄袨锌褑懈懈	7
袣褉懈褌械褉懈泄袨褌斜芯褉邪	6
袩芯褋谢械写芯胁邪褌械谢褜薪芯褋褌褜	5
袩谢邪薪袙懈写芯胁袪邪褋褔械褌邪	3
啸褉邪薪懈谢懈褖械袧邪褋褌褉芯械泻	3
袪械谐懈褋褌褉袘褍褏谐邪谢褌械褉懈懈	1
袩谢邪薪小褔械褌芯胁	1
袧褍屑械褉邪褌芯褉袛芯泻褍屑械薪褌芯胁	1
袠薪褌械谐褉邪褑懈芯薪薪褘泄小械褉胁懈褋	1
袟邪写邪褔邪	1
WS小褋褘谢泻邪	1
